<?xml version="1.0" encoding="iso-8859-1"?>
<!DOCTYPE records SYSTEM "file://SmeRecords.dtd">

<records>
<smerecord type="smpp" uid="profiler">
  <param name="typeOfNumber" value="1"/>
  <param name="numberingPlan" value="1"/>
  <param name="interfaceVersion" value="34"/>
  <param name="systemType" value="internal"/>
  <param name="password" value=""/>
  <param name="addrRange" value=".*"/>
  <param name="smeN" value="-1"/>
  <param name="wantAlias" value="no"/>
  <param name="forceDC" value="false"/>
  <param name="timeout" value="20"/>
  <param name="receiptSchemeName" value="default"/>
  <param name="priority" value="16384"/>
  <param name="disabled" value="false"/>
  <param name="mode" value="trx"/>
  <param name="proclimit" value="0"/>
  <param name="schedlimit" value="0"/>
  <param name="accessMask" value="1"/>  
</smerecord>
<smerecord type="smpp" uid="NULLSME">
  <param name="typeOfNumber" value="1"/>
  <param name="numberingPlan" value="1"/>
  <param name="interfaceVersion" value="34"/>
  <param name="systemType" value="internal"/>
  <param name="password" value=""/>
  <param name="addrRange" value=""/>
  <param name="smeN" value="-1"/>
  <param name="wantAlias" value="no"/>
  <param name="forceDC" value="false"/>
  <param name="timeout" value="20"/>
  <param name="receiptSchemeName" value="default"/>
  <param name="priority" value="16384"/>
  <param name="disabled" value="false"/>
  <param name="mode" value="trx"/>
  <param name="proclimit" value="0"/>
  <param name="schedlimit" value="0"/>
  <param name="accessMask" value="1"/>  
</smerecord>
<smerecord type="smpp" uid="abonentinfo">
  <param name="typeOfNumber" value="1"/>
  <param name="numberingPlan" value="1"/>
  <param name="interfaceVersion" value="34"/>
  <param name="systemType" value="internal"/>
  <param name="password" value=""/>
  <param name="addrRange" value=".*"/>
  <param name="smeN" value="-1"/>
  <param name="wantAlias" value="no"/>
  <param name="forceDC" value="false"/>
  <param name="timeout" value="20"/>
  <param name="receiptSchemeName" value="default"/>
  <param name="priority" value="16384"/>
  <param name="disabled" value="false"/>
  <param name="mode" value="trx"/>
  <param name="proclimit" value="0"/>
  <param name="schedlimit" value="0"/>
  <param name="accessMask" value="1"/>  
</smerecord>
<smerecord type="smpp" uid="MAP_PROXY">
  <param name="typeOfNumber" value="1"/>
  <param name="numberingPlan" value="1"/>
  <param name="interfaceVersion" value="34"/>
  <param name="systemType" value="internal"/>
  <param name="password" value=""/>
  <param name="addrRange" value=".*"/>
  <param name="smeN" value="-1"/>
  <param name="wantAlias" value="no"/>
  <param name="forceDC" value="false"/>
  <param name="timeout" value="20"/>
  <param name="receiptSchemeName" value="default"/>
  <param name="priority" value="16384"/>
  <param name="disabled" value="false"/>
  <param name="mode" value="trx"/>
  <param name="proclimit" value="5000"/>
  <param name="schedlimit" value="0"/>
  <param name="accessMask" value="1"/>  
</smerecord>
<smerecord type="smpp" uid="smscsme">
  <param name="typeOfNumber" value="1"/>
  <param name="numberingPlan" value="1"/>
  <param name="interfaceVersion" value="52"/>
  <param name="systemType" value="internal"/>
  <param name="password" value=""/>
  <param name="addrRange" value=".*"/>
  <param name="smeN" value="-1"/>
  <param name="wantAlias" value="no"/>
  <param name="forceDC" value="false"/>
  <param name="timeout" value="20"/>
  <param name="receiptSchemeName" value="default"/>
  <param name="priority" value="16384"/>
  <param name="disabled" value="false"/>
  <param name="mode" value="trx"/>
  <param name="proclimit" value="0"/>
  <param name="schedlimit" value="0"/>
  <param name="accessMask" value="1"/>  
</smerecord>
<smerecord type="smpp" uid="scheduler">
  <param name="typeOfNumber" value="1"/>
  <param name="numberingPlan" value="1"/>
  <param name="interfaceVersion" value="34"/>
  <param name="systemType" value="internal"/>
  <param name="password" value=""/>
  <param name="addrRange" value=""/>
  <param name="smeN" value="-1"/>
  <param name="wantAlias" value="no"/>
  <param name="forceDC" value="false"/>
  <param name="timeout" value="20"/>
  <param name="receiptSchemeName" value="default"/>
  <param name="priority" value="16384"/>
  <param name="disabled" value="false"/>
  <param name="mode" value="trx"/>
  <param name="proclimit" value="0"/>
  <param name="schedlimit" value="0"/>
  <param name="accessMask" value="1"/>  
</smerecord>
<smerecord type="smpp" uid="DSTRLST">
  <param name="typeOfNumber" value="1"/>
  <param name="numberingPlan" value="1"/>
  <param name="interfaceVersion" value="34"/>
  <param name="systemType" value="internal"/>
  <param name="password" value=""/>
  <param name="addrRange" value=".*"/>
  <param name="smeN" value="-1"/>
  <param name="wantAlias" value="no"/>
  <param name="forceDC" value="false"/>
  <param name="timeout" value="20"/>
  <param name="receiptSchemeName" value="default"/>
  <param name="priority" value="16384"/>
  <param name="disabled" value="false"/>
  <param name="mode" value="trx"/>
  <param name="proclimit" value="0"/>
  <param name="schedlimit" value="0"/>
  <param name="accessMask" value="1"/>  
</smerecord>
<smerecord type="smpp" uid="INMANCOMM">
  <param name="typeOfNumber" value="1"/>
  <param name="numberingPlan" value="1"/>
  <param name="interfaceVersion" value="34"/>
  <param name="systemType" value="internal"/>
  <param name="password" value=""/>
  <param name="addrRange" value=".*"/>
  <param name="smeN" value="-1"/>
  <param name="wantAlias" value="no"/>
  <param name="forceDC" value="false"/>
  <param name="timeout" value="20"/>
  <param name="receiptSchemeName" value="default"/>
  <param name="priority" value="16384"/>
  <param name="disabled" value="false"/>
  <param name="mode" value="trx"/>
  <param name="proclimit" value="0"/>
  <param name="schedlimit" value="0"/>
  <param name="accessMask" value="1"/>  
</smerecord>
</records>
